{
  "contract_id": "workbench-panel-registry",
  "contract_version": "1.0.0",
  "governed_by_rfc": "RFC-0077",
  "related_rfcs": [
    "RFC-0075",
    "RFC-0076",
    "RFC-0079",
    "RFC-0041",
    "RFC-0042",
    "RFC-0026",
    "RFC-0027"
  ],
  "canonical_data_contract": "canonical-front-office-demo-data-contract",
  "panels": [
    {
      "panel_id": "advisor.book_overview",
      "display_name": "My Book",
      "screen_id": "advisor.book_overview",
      "route": "/book?asOfDate={canonicalAsOfDate}",
      "panel_kind": "workflow_panel",
      "panel_level": "panel",
      "parent_panel_id": null,
      "owning_service": "lotus-gateway",
      "gateway_endpoint": "/api/v1/advisor-book/portfolios",
      "canonical_data_contract": "canonical-front-office-demo-data-contract",
      "required_support_state": "partial",
      "allowed_states": [
        "ready",
        "loading",
        "empty",
        "partial",
        "permission_blocked",
        "unavailable",
        "error"
      ],
      "validation_rules": {
        "ready": [
          "the advisor's assigned portfolios render through Gateway",
          "portfolio identity and assignment basis remain source-owned",
          "portfolio context switching preserves the selected advisor task"
        ],
        "partial": [
          "own-book scope and any Gateway-reported assignment limitations remain explicit",
          "delegated, team, and supervisor coverage is not inferred"
        ],
        "empty": [
          "absence of assigned portfolios is explicit for the authenticated advisor context"
        ],
        "loading": ["advisor-book route hydration only"],
        "permission_blocked": [
          "missing or ineligible advisor authority is explicit without exposing portfolio membership"
        ],
        "unavailable": [
          "Gateway advisor-book unavailability is explicit and no global portfolio catalogue is substituted"
        ],
        "error": ["Gateway advisor-book failure is explicit and user-visible"]
      },
      "screenshot_policy": {
        "capture_required": true,
        "screenshot_name": "advisor-book-overview-live.png"
      },
      "evidence_required": true,
      "methodology_reference": null,
      "known_limitations": [
        "own-book scope only; delegated, team, and supervisor scope are not supported",
        "tenant context and legacy assignment limitations remain visible when reported by Gateway"
      ],
      "out_of_scope_reason": null,
      "owner_follow_up_rfc": null
    },
    {
      "panel_id": "portfolio.summary",
      "display_name": "Portfolio Summary",
      "screen_id": "portfolio.summary",
      "route": "/portfolio?portfolioId={portfolio_id}",
      "panel_kind": "summary_panel",
      "panel_level": "panel",
      "parent_panel_id": null,
      "owning_service": "lotus-gateway",
      "gateway_endpoint": "/api/v1/workbench/{portfolio_id}/overview",
      "canonical_data_contract": "canonical-front-office-demo-data-contract",
      "required_support_state": "ready",
      "allowed_states": ["ready", "loading", "error"],
      "validation_rules": {
        "ready": [
          "portfolio shell renders",
          "top holdings chart contains ranked rows",
          "allocation donut renders"
        ],
        "loading": ["transient route hydration only"],
        "error": ["route load failure is explicit and user-visible"]
      },
      "screenshot_policy": {
        "capture_required": true,
        "screenshot_name": "portfolio-summary-live.png"
      },
      "evidence_required": true,
      "methodology_reference": null,
      "known_limitations": [],
      "out_of_scope_reason": null,
      "owner_follow_up_rfc": null
    },
    {
      "panel_id": "portfolio.detailed",
      "display_name": "Portfolio Detailed",
      "screen_id": "portfolio.detailed",
      "route": "/portfolio?portfolioId={portfolio_id}&tab=detailed",
      "panel_kind": "detail_panel",
      "panel_level": "panel",
      "parent_panel_id": null,
      "owning_service": "lotus-gateway",
      "gateway_endpoint": "/api/v1/workbench/{portfolio_id}/overview",
      "canonical_data_contract": "canonical-front-office-demo-data-contract",
      "required_support_state": "ready",
      "allowed_states": ["ready", "loading", "error"],
      "validation_rules": {
        "ready": [
          "transactions section renders",
          "projected cashflow section renders",
          "transactions grid shell renders",
          "projected cashflow summary renders"
        ],
        "loading": ["transient route hydration only"],
        "error": ["route load failure is explicit and user-visible"]
      },
      "screenshot_policy": {
        "capture_required": true,
        "screenshot_name": "portfolio-detailed-live.png"
      },
      "evidence_required": true,
      "methodology_reference": null,
      "known_limitations": [],
      "out_of_scope_reason": null,
      "owner_follow_up_rfc": null
    },
    {
      "panel_id": "reporting.report_centre",
      "display_name": "Report Centre",
      "screen_id": "reporting.report_centre",
      "route": "/reports?portfolioId={portfolio_id}",
      "panel_kind": "workflow_panel",
      "panel_level": "panel",
      "parent_panel_id": null,
      "owning_service": "lotus-report",
      "gateway_endpoint": "/api/v1/report-ordering/options",
      "canonical_data_contract": "canonical-front-office-demo-data-contract",
      "required_support_state": "partial",
      "allowed_states": [
        "ready",
        "loading",
        "empty",
        "partial",
        "permission_blocked",
        "unavailable",
        "error"
      ],
      "validation_rules": {
        "ready": [
          "eligible report families and portfolio configuration render through Gateway",
          "format availability and configuration dependencies remain source-owned",
          "submission and request history distinguish report data from archive and client delivery"
        ],
        "partial": [
          "available structured report data remains usable while unavailable document formats are explicit",
          "book, client-delivery, archive, and approval limitations are not promoted as supported"
        ],
        "empty": [
          "absence of eligible report families is explicit for the selected portfolio context"
        ],
        "loading": ["report-centre route hydration only"],
        "permission_blocked": [
          "report-ordering authority or portfolio eligibility restrictions are explicit without exposing restricted catalogue choices"
        ],
        "unavailable": [
          "Gateway report-ordering unavailability is explicit and no browser-authored catalogue is substituted"
        ],
        "error": ["Gateway report-ordering failure is explicit and user-visible"]
      },
      "screenshot_policy": {
        "capture_required": true,
        "screenshot_name": "reporting-report-centre-live.png"
      },
      "evidence_required": true,
      "methodology_reference": null,
      "known_limitations": [
        "structured report data is available while governed PDF creation remains independently source-owned",
        "report-data completion does not claim archive, advisor approval, client delivery, or communication"
      ],
      "out_of_scope_reason": null,
      "owner_follow_up_rfc": null
    },
    {
      "panel_id": "performance.summary",
      "display_name": "Performance Summary",
      "screen_id": "performance.summary",
      "route": "/performance?portfolioId={portfolio_id}",
      "panel_kind": "summary_panel",
      "panel_level": "panel",
      "parent_panel_id": null,
      "owning_service": "lotus-performance",
      "gateway_endpoint": "/api/v1/workbench/{portfolio_id}/performance/summary",
      "canonical_data_contract": "canonical-front-office-demo-data-contract",
      "required_support_state": "ready",
      "allowed_states": ["ready", "partial", "loading", "error"],
      "validation_rules": {
        "ready": [
          "net return path loads",
          "performance drivers loads",
          "return path table has at least 4 rows"
        ],
        "partial": [
          "usable performance results load with an explicit source-supportability limitation",
          "the limitation remains visible and does not satisfy canonical ready-state certification"
        ],
        "loading": ["transient route hydration only"],
        "error": ["summary load failure is explicit and user-visible"]
      },
      "screenshot_policy": {
        "capture_required": true,
        "screenshot_name": "performance-summary-live.png"
      },
      "evidence_required": true,
      "methodology_reference": "lotus-performance/docs/methodologies",
      "known_limitations": [],
      "out_of_scope_reason": null,
      "owner_follow_up_rfc": null
    },
    {
      "panel_id": "performance.analysis.contribution",
      "display_name": "Performance Contribution",
      "screen_id": "performance.analysis",
      "route": "/performance?portfolioId={portfolio_id}&mode=analysis",
      "panel_kind": "analytic_panel",
      "panel_level": "subpanel",
      "parent_panel_id": "performance.summary",
      "owning_service": "lotus-performance",
      "gateway_endpoint": "/api/v1/workbench/{portfolio_id}/performance/details",
      "canonical_data_contract": "canonical-front-office-demo-data-contract",
      "required_support_state": "ready",
      "allowed_states": ["ready", "partial", "loading", "error"],
      "validation_rules": {
        "ready": [
          "performance drivers table is populated",
          "contribution rows reconcile to net portfolio return"
        ],
        "partial": [
          "available contribution rows and source evidence remain visible",
          "missing component coverage and owner reason are explicit",
          "partial does not satisfy canonical ready-state certification"
        ],